{
  "name": "redux",
  "order": 4,
  "enabledWhen": "store:redux",
  "dependencies": {
    "@reduxjs/toolkit": "^2.5.0",
    "react-redux": "^9.2.0"
  },
  "providerWrapper": {
    "imports": ["import ReduxProvider from './redux-provider';"],
    "component": "<ReduxProvider>"
  },
  "cleanup": {
    "cleanupStores": true
  }
}
